{
  "schema_version": "1.0",
  "control_id": "CCHIA-AGT-005",
  "case": "positive",
  "expected_status": "FAIL",
  "context": {
    "signals": ["agent", "high-impact-tools"],
    "signal_evidence": {
      "agent": ["system.agents"],
      "high-impact-tools": ["system.tools[0].effect"]
    },
    "collection": {"complete": true}
  }
}
